{
  "schema_version": 1,
  "catalog_version": "1.0.0",
  "generated_at": "2026-07-24",
  "components": [
    {
      "id": "core",
      "plugin": "amir_system",
      "version": "1.0.0",
      "scope": "user",
      "description": "Project lifecycle core: create/onboard projects, orchestrate subagents, manage the project registry, configure/validate/repair project component selections, and browse the catalog.",
      "official_source": "internal",
      "license": "Proprietary (personal use)",
      "supported_hosts": [
        "claude-code",
        "cursor"
      ],
      "supported_operating_systems": [
        "windows",
        "macos",
        "linux"
      ],
      "installation_mode": "user-plugin",
      "dependencies": [],
      "optional_dependencies": [],
      "conflicts_with": [],
      "required_executables": [
        "python"
      ],
      "required_credentials": [],
      "network_access": "none",
      "secret_access": "none",
      "filesystem_access": "project_and_user_state",
      "write_capabilities": [
        "project_files",
        "user_registry"
      ],
      "destructive_capabilities": [
        "remove_project_config (backed up, confirmed, Amir-managed files only)"
      ],
      "resource_requirements": {},
      "health_check": "python \"%USERPROFILE%\\.amir\\bin\\amirctl.py\" doctor",
      "uninstall_method": "Uninstall the amir_system user plugin (claude plugin uninstall amir_system; remove the %USERPROFILE%\\.cursor\\plugins\\local\\amir_system junction).",
      "commands": [
        "cleanup_context",
        "configure_project",
        "create_project",
        "graph_projects_add",
        "graph_projects_dependencies",
        "graph_projects_list",
        "graph_projects_query",
        "graph_projects_rebuild",
        "graph_projects_remove",
        "graph_projects_report",
        "graph_projects_status",
        "graph_projects_update",
        "graph_projects_update_all",
        "graph_projects_validate",
        "help",
        "list_components",
        "list_projects",
        "onboard_project",
        "plugins_list",
        "project_add_plugin",
        "project_disable_plugin",
        "project_list_plugins",
        "project_status",
        "remove_project_config",
        "repair_project",
        "update_catalog",
        "use_subagents",
        "user_subagents2",
        "amir_critical",
        "amir_handoff",
        "amir_doc_review",
        "amir_humanized",
        "btw",
        "validate_project",
        "amir_cursor_subagent"
      ],
      "skills": [
        "create_project",
        "onboard_project",
        "use_subagents",
        "user_subagents2",
        "amir_critical",
        "amir_handoff",
        "amir_doc_review",
        "amir_humanized",
        "btw",
        "cleanup_context",
        "create-project-doc",
        "no-slop",
        "amir-project-cleanup",
        "amir_cursor_subagent"
      ],
      "mcp_servers": []
    },
    {
      "id": "graphify",
      "plugin": "amir_system",
      "version": "1.0.0",
      "scope": "user",
      "description": "Graphify knowledge-graph wrappers: build/update/query/explain a project-scoped code graph, impact analysis, architecture doc generation. Project-scoped only; never global registration without explicit approval.",
      "official_source": "https://pypi.org/project/graphifyy/",
      "license": "See PyPI package graphifyy (verify upstream)",
      "supported_hosts": [
        "claude-code",
        "cursor"
      ],
      "supported_operating_systems": [
        "windows",
        "macos",
        "linux"
      ],
      "installation_mode": "user-plugin",
      "dependencies": [],
      "optional_dependencies": [],
      "conflicts_with": [],
      "required_executables": [
        "graphify"
      ],
      "required_credentials": [],
      "network_access": "none",
      "secret_access": "none",
      "filesystem_access": "project",
      "write_capabilities": [
        "project_files (.amir/graphify-out/, host hook registration inside project)"
      ],
      "destructive_capabilities": [
        "graphify_clean deletes this project's .amir/graphify-out/ (shown first)"
      ],
      "resource_requirements": {
        "disk": "Graph output can reach hundreds of MB on large repos",
        "notes": "Full builds are CPU-heavy on large repos; prefer incremental update."
      },
      "health_check": "graphify --version",
      "uninstall_method": "graphify uninstall / graphify hook uninstall inside the project; the graphify CLI itself is never uninstalled automatically.",
      "commands": [
        "graphify",
        "graphify_setup",
        "graphify_build",
        "graphify_update",
        "graphify_query",
        "graphify_explain",
        "graphify_status",
        "graphify_impact",
        "graphify_architecture",
        "graphify_clean",
        "graphify_disable"
      ],
      "skills": [],
      "mcp_servers": []
    },
    {
      "id": "asana",
      "plugin": "amir_system",
      "version": "1.0.0",
      "scope": "user",
      "description": "Asana MCP server (custom client over the Asana REST API) plus nine task-management skills and health-check commands. Default posture is read-only; writes require confirmation.",
      "official_source": "internal (client for https://developers.asana.com/reference/rest-api-reference)",
      "license": "Proprietary (personal use)",
      "supported_hosts": [
        "claude-code",
        "cursor"
      ],
      "supported_operating_systems": [
        "windows",
        "macos",
        "linux"
      ],
      "installation_mode": "user-plugin",
      "dependencies": [],
      "optional_dependencies": [],
      "conflicts_with": [],
      "required_executables": [
        "node",
        "python"
      ],
      "required_credentials": [
        "ASANA_ACCESS_TOKEN"
      ],
      "network_access": "required",
      "secret_access": "required",
      "filesystem_access": "project_and_user_state",
      "write_capabilities": [
        "external_service:asana (tasks, comments, sections, tags)"
      ],
      "destructive_capabilities": [
        "complete/modify Asana tasks (confirmation required; never deletes)"
      ],
      "resource_requirements": {},
      "health_check": "node --version && python -c \"import os,sys; missing=[v for v in ('ASANA_ACCESS_TOKEN',) if not os.environ.get(v)]; print(('missing: '+', '.join(missing)) if missing else 'ok'); sys.exit(1 if missing else 0)\"",
      "uninstall_method": "Disable via manifest system_capabilities.asana.allowed=false; user-scope removal with the amir_system plugin. Token file %USERPROFILE%\\.amir\\secrets\\asana.env is never deleted automatically.",
      "commands": [
        "asana_status",
        "asana_auth_check"
      ],
      "skills": [
        "asana_complete_task",
        "asana_create_task",
        "asana_daily_triage",
        "asana_priorities_today",
        "asana_review_tasks",
        "asana_standup",
        "asana_sync_from_report",
        "asana_update",
        "asana_update_task"
      ],
      "mcp_servers": [
        "asana"
      ]
    },
    {
      "id": "playwright",
      "plugin": "amir_system",
      "version": "1.0.0",
      "scope": "user",
      "description": "Official Playwright MCP server (@playwright/mcp) for browser automation with isolated profiles. Availability is not authorization: manifest system_capabilities.playwright.allowed gates use.",
      "official_source": "https://github.com/microsoft/playwright-mcp",
      "license": "Apache-2.0",
      "supported_hosts": [
        "claude-code",
        "cursor"
      ],
      "supported_operating_systems": [
        "windows",
        "macos",
        "linux"
      ],
      "installation_mode": "user-plugin",
      "dependencies": [],
      "optional_dependencies": [],
      "conflicts_with": [],
      "required_executables": [
        "node",
        "npx"
      ],
      "required_credentials": [],
      "network_access": "required",
      "secret_access": "none",
      "filesystem_access": "project",
      "write_capabilities": [
        "project_files (screenshots/traces/artifacts inside project)",
        "browser_actions (isolated profile)"
      ],
      "destructive_capabilities": [],
      "resource_requirements": {
        "memory": "Browser instances typically need 500 MB+ each"
      },
      "health_check": "npx --yes @playwright/mcp@latest --version",
      "uninstall_method": "Disable via manifest system_capabilities.playwright.allowed=false; npx cache eviction is optional and manual.",
      "commands": [],
      "skills": [],
      "mcp_servers": [
        "playwright"
      ]
    },
    {
      "id": "rules",
      "plugin": "amir_system",
      "version": "1.0.0",
      "scope": "user",
      "description": "The seven Amir system rules (project-isolation, tool-scope, security-secrets, honest-execution, goal-preservation, context-control, destructive-action) as Cursor .mdc rules and the Claude system_rules skill.",
      "official_source": "internal",
      "license": "Proprietary (personal use)",
      "supported_hosts": [
        "claude-code",
        "cursor"
      ],
      "supported_operating_systems": [
        "windows",
        "macos",
        "linux"
      ],
      "installation_mode": "user-plugin",
      "dependencies": [],
      "optional_dependencies": [],
      "conflicts_with": [],
      "required_executables": [],
      "required_credentials": [],
      "network_access": "none",
      "secret_access": "none",
      "filesystem_access": "project",
      "write_capabilities": [],
      "destructive_capabilities": [],
      "resource_requirements": {},
      "health_check": "python \"%USERPROFILE%\\.amir\\bin\\amirctl.py\" doctor",
      "uninstall_method": "Uninstall the amir_system user plugin (claude plugin uninstall amir_system; remove the %USERPROFILE%\\.cursor\\plugins\\local\\amir_system junction).",